{
  "schema": "dailyfuel/map-weigh-ntad/1",
  "source": "Bureau of Transportation Statistics, National Transportation Atlas Database, Truck Stop Parking",
  "source_url": "https://services.arcgis.com/xOi1kZaI0eWDREZv/arcgis/rest/services/NTAD_Truck_Stop_Parking/FeatureServer/0",
  "licence": "Public domain, a work of the United States government",
  "licence_note": "This NTAD dataset is a work of the United States government as defined in 17 U.S.C. § 101 and as such are not protected by any U.S. copyrights. This work is available for unrestricted public use.",
  "attribution": "Weigh station rows from the Truck Stop Parking dataset, FHWA and BTS (NTAD), compiled 2019",
  "compiled": "2019-04-09",
  "filter": "rows whose nhs_rest_stop name contains weigh or scale",
  "query_url": "https://services.arcgis.com/xOi1kZaI0eWDREZv/arcgis/rest/services/NTAD_Truck_Stop_Parking/FeatureServer/0/query?where=UPPER%28nhs_rest_stop%29+LIKE+%27%25WEIGH%25%27+OR+UPPER%28nhs_rest_stop%29+LIKE+%27%25SCALE%25%27&outFields=%2A&orderByFields=OBJECTID&resultRecordCount=2000&f=json",
  "fetched": "2026-09-23",
  "counts": {
    "rows": 111,
    "sites": 111,
    "dropped_outside_us": 0
  },
  "sites": [
    {
      "lat": 24.9546,
      "lon": -80.5813,
      "name": "Plantation Key - Weight Station / Comfort Station",
      "state": "FL",
      "route": "SR5/US1",
      "milepost": "86",
      "spots": 4,
      "id": 204
    },
    {
      "lat": 26.87916,
      "lon": -81.98599,
      "name": "Weigh Station",
      "state": "FL",
      "route": "I-75N",
      "milepost": "158",
      "spots": 33,
      "id": 212
    },
    {
      "lat": 26.8799,
      "lon": -81.985,
      "name": "Weigh Station",
      "state": "FL",
      "route": "I-75S",
      "milepost": "158",
      "spots": 33,
      "id": 213
    },
    {
      "lat": 27.0049,
      "lon": -80.2054,
      "name": "Weigh Station",
      "state": "FL",
      "route": "I-95N",
      "milepost": "92",
      "spots": 18,
      "id": 215
    },
    {
      "lat": 27.1891,
      "lon": -80.4008,
      "name": "Weigh Station",
      "state": "FL",
      "route": "I-95S",
      "milepost": "112",
      "spots": 34,
      "id": 218
    },
    {
      "lat": 28.0155,
      "lon": -82.2652,
      "name": "Weigh Station",
      "state": "FL",
      "route": "I-4E",
      "milepost": "12",
      "spots": 15,
      "id": 229
    },
    {
      "lat": 28.0185,
      "lon": -82.2727,
      "name": "Weigh Station",
      "state": "FL",
      "route": "I-4W",
      "milepost": "12",
      "spots": 15,
      "id": 230
    },
    {
      "lat": 28.9929,
      "lon": -82.1439,
      "name": "Weigh Station",
      "state": "FL",
      "route": "I-75N",
      "milepost": "338",
      "spots": 29,
      "id": 244
    },
    {
      "lat": 28.9935,
      "lon": -82.1429,
      "name": "Weigh Station",
      "state": "FL",
      "route": "I-75S",
      "milepost": "338",
      "spots": 28,
      "id": 245
    },
    {
      "lat": 29.5108,
      "lon": -81.1971,
      "name": "Weigh Station",
      "state": "FL",
      "route": "I-95N",
      "milepost": "286",
      "spots": 41,
      "id": 248
    },
    {
      "lat": 29.5108,
      "lon": -81.1971,
      "name": "Weigh Station",
      "state": "FL",
      "route": "I-95S",
      "milepost": "286",
      "spots": 41,
      "id": 249
    },
    {
      "lat": 30.3734,
      "lon": -83.2726,
      "name": "Weigh Station",
      "state": "FL",
      "route": "I-10E",
      "milepost": "264",
      "spots": 27,
      "id": 265
    },
    {
      "lat": 30.3747,
      "lon": -83.2723,
      "name": "Weigh Station",
      "state": "FL",
      "route": "I-10W",
      "milepost": "264",
      "spots": 27,
      "id": 266
    },
    {
      "lat": 30.4181,
      "lon": -82.8985,
      "name": "Weigh Station",
      "state": "FL",
      "route": "I-75S",
      "milepost": "449",
      "spots": 39,
      "id": 267
    },
    {
      "lat": 30.4215,
      "lon": -82.9029,
      "name": "Weigh Station",
      "state": "FL",
      "route": "I-75N",
      "milepost": "449",
      "spots": 31,
      "id": 268
    },
    {
      "lat": 30.5531,
      "lon": -87.3627,
      "name": "Weigh Station",
      "state": "FL",
      "route": "I-10E",
      "milepost": "4",
      "spots": 39,
      "id": 274
    },
    {
      "lat": 30.5539,
      "lon": -87.362,
      "name": "Weigh Station",
      "state": "FL",
      "route": "I-10W",
      "milepost": "4",
      "spots": 39,
      "id": 275
    },
    {
      "lat": 30.6388,
      "lon": -84.9825,
      "name": "Weigh Station",
      "state": "FL",
      "route": "I-10E",
      "milepost": "155",
      "spots": 39,
      "id": 280
    },
    {
      "lat": 30.6398,
      "lon": -84.9829,
      "name": "Weigh Station",
      "state": "FL",
      "route": "I-10W",
      "milepost": "155",
      "spots": 39,
      "id": 281
    },
    {
      "lat": 30.66924,
      "lon": -81.66873,
      "name": "Weigh Station",
      "state": "FL",
      "route": "I-95S",
      "milepost": "376",
      "spots": 30,
      "id": 282
    },
    {
      "lat": 30.6696,
      "lon": -81.667,
      "name": "Weigh Station",
      "state": "FL",
      "route": "I-95N",
      "milepost": "376",
      "spots": 30,
      "id": 283
    },
    {
      "lat": 30.917,
      "lon": -83.365,
      "name": "Georgia Weigh Station Region 8 South(Lowndes)",
      "state": "GA",
      "route": "I-75S",
      "milepost": "23",
      "spots": 30,
      "id": 293
    },
    {
      "lat": 30.918,
      "lon": -83.364,
      "name": "Georgia Weigh Station Region 8 North (Lowndes)",
      "state": "GA",
      "route": "I-75N",
      "milepost": "23",
      "spots": 30,
      "id": 294
    },
    {
      "lat": 31.477,
      "lon": -81.448,
      "name": "Georgia Weigh Station Region 9 South (McIntosh)",
      "state": "GA",
      "route": "I-95S",
      "milepost": "54",
      "spots": 58,
      "id": 299
    },
    {
      "lat": 31.477,
      "lon": -81.446,
      "name": "Georgia Weigh Station Region 9 North (McIntosh)",
      "state": "GA",
      "route": "I-95N",
      "milepost": "54",
      "spots": 56,
      "id": 298
    },
    {
      "lat": 32.167,
      "lon": -81.443,
      "name": "Georgia Weigh Station Region 7 East (Bryan)",
      "state": "GA",
      "route": "I-16E",
      "milepost": "144",
      "spots": 35,
      "id": 303
    },
    {
      "lat": 32.17025,
      "lon": -81.44461,
      "name": "Georgia Weigh Station Region 7 West (Bryan)",
      "state": "GA",
      "route": "I-16W",
      "milepost": "144",
      "spots": 35,
      "id": 304
    },
    {
      "lat": 32.216,
      "lon": -81.174,
      "name": "Georgia Weigh Station Region 7 (Chatham )",
      "state": "GA",
      "route": "I-95S",
      "milepost": "110",
      "spots": 18,
      "id": 306
    },
    {
      "lat": 33.069,
      "lon": -83.973,
      "name": "Georgia Weigh Station Region 6 South (Monroe)",
      "state": "GA",
      "route": "I-75S",
      "milepost": "190",
      "spots": 14,
      "id": 314
    },
    {
      "lat": 33.07,
      "lon": -83.973,
      "name": "Georgia Weigh Station Region 6 North(Monroe)",
      "state": "GA",
      "route": "I-75N",
      "milepost": "190",
      "spots": 14,
      "id": 315
    },
    {
      "lat": 33.083,
      "lon": -84.916,
      "name": "Georgia Weigh Station Region 5 North (Troup)",
      "state": "GA",
      "route": "I-85N",
      "milepost": "22.5",
      "spots": 20,
      "id": 316
    },
    {
      "lat": 33.087,
      "lon": -84.915,
      "name": "Georgia Weigh Station Region 5 South (Troup)",
      "state": "GA",
      "route": "I-85S",
      "milepost": "22.5",
      "spots": 20,
      "id": 317
    },
    {
      "lat": 33.487,
      "lon": -82.237,
      "name": "Georgia Weigh Station Region 4 West (Columbia)",
      "state": "GA",
      "route": "I-20W",
      "milepost": "187",
      "spots": 31,
      "id": 319
    },
    {
      "lat": 33.487,
      "lon": -82.233,
      "name": "Georgia Weigh Station Region 4 East (Columbia)",
      "state": "GA",
      "route": "I-20E",
      "milepost": "187",
      "spots": 55,
      "id": 318
    },
    {
      "lat": 33.696,
      "lon": -85.085,
      "name": "Georgia Weigh Station Region 3 West (Carroll)",
      "state": "GA",
      "route": "I-20W",
      "milepost": "15",
      "spots": 53,
      "id": 326
    },
    {
      "lat": 33.772,
      "lon": -84.63,
      "name": "Georgia Weigh Station Region 3 East(Douglas)",
      "state": "GA",
      "route": "I-20E",
      "milepost": "42",
      "spots": 13,
      "id": 327
    },
    {
      "lat": 34.415,
      "lon": -83.178,
      "name": "Georgia Weigh Station Region 2 South(Franklin)",
      "state": "GA",
      "route": "I-85S",
      "milepost": "170",
      "spots": 76,
      "id": 329
    },
    {
      "lat": 34.427,
      "lon": -83.156,
      "name": "Georgia Weigh Station Region 2 North (Franklin)",
      "state": "GA",
      "route": "I-85N",
      "milepost": "171",
      "spots": 76,
      "id": 330
    },
    {
      "lat": 34.879,
      "lon": -85.048,
      "name": "Georgia Weigh Station Region 1 North (Catoosa )",
      "state": "GA",
      "route": "I-75N",
      "milepost": "342",
      "spots": 35,
      "id": 333
    },
    {
      "lat": 34.88,
      "lon": -85.052,
      "name": "Georgia Weigh Station Region 1 South (Catoosa)",
      "state": "GA",
      "route": "I-75S",
      "milepost": "342",
      "spots": 35,
      "id": 334
    },
    {
      "lat": 42.46856,
      "lon": -87.9473,
      "name": "Weigh Station US  41",
      "state": "IL",
      "route": "US 41",
      "milepost": null,
      "spots": 3,
      "id": 446
    },
    {
      "lat": 36.507,
      "lon": -88.897,
      "name": "US-51/Julian Carroll Pkwy Weigh Station",
      "state": "KY",
      "route": "KY-9003 Carroll Pkwy",
      "milepost": "1",
      "spots": 3,
      "id": 523
    },
    {